{
  "schemaVersion": 1,
  "protocol": "enterpriseai.inference.v1",
  "executable": "inference-worker.exe",
  "engine": "llama.cpp",
  "revision": "a0e6dc7384edb8f5d927155e1d26c10b4a310e6d+static-only.sha256=e3c3ca872bfcc2db926a05c573d2193eea5f7eb48e295e54c01f10ea74c1ce49+cpu-avx2-v2-progress",
  "architecture": "windows-x64",
  "supportedIsa": [
    "x86-64",
    "avx2"
  ],
  "weights": {
    "path": "weights/Qwen3.5-4B-baseline-Q6_K.gguf",
    "sha256": "3acaea00a98af4e8cb7195259d7dd903b0cc749dff61a8cf47274c9a91ed02f6"
  },
  "precision": "Q6_K",
  "contextTokens": 16384,
  "threads": 12,
  "minFreeMemoryBytes": 8589934592,
  "maxProcessMemoryBytes": 6442450944,
  "files": [
    {
      "path": "Download-weights.ps1",
      "sha256": "ec71dc4028e202ecb4fc267c120fd75dac204756645c9ab94ceb5e7c2a09a541"
    },
    {
      "path": "inference-worker.exe",
      "sha256": "48c2a1394571d7dae79e20577ec26a4d57e8084a6c7f32c491387f29c4963bf7"
    },
    {
      "path": "licenses/ENGINE-MODIFICATIONS.txt",
      "sha256": "a3183eeaf0c7160f8577061d3bf0c9fecc7a7914b9f7b633e2592dd1f8034542"
    },
    {
      "path": "licenses/llama-static-only.patch",
      "sha256": "e3c3ca872bfcc2db926a05c573d2193eea5f7eb48e295e54c01f10ea74c1ce49"
    },
    {
      "path": "licenses/llama.cpp-MIT.txt",
      "sha256": "bcd8ec749126d45cb06737d0690295d73df4b6e7e194205bcf91190368f27285"
    },
    {
      "path": "licenses/Microsoft-STL-Apache-2.0-with-LLVM-exception.txt",
      "sha256": "1fc6b6db121d4555d8f661937d7f6013693cd8fd67495d5e5d98c1d18fb83eda"
    },
    {
      "path": "licenses/Microsoft-STL-NOTICE.txt",
      "sha256": "a1d49c2454690fecb4e64d214a36f51aac4f2e7209b9443ba450c611374dd681"
    },
    {
      "path": "licenses/Microsoft-VC-Runtime-LICENSE.txt",
      "sha256": "923d8b11a03c277d59f3262727abc7e422158f5243a5565d67d5c270c6b05e3c"
    },
    {
      "path": "licenses/nlohmann-json-MIT.txt",
      "sha256": "61e08da79c44061654015ce6b0c4061c23ee1dd18237fbf09e9bfda3c0ea2831"
    },
    {
      "path": "licenses/NOTICE.txt",
      "sha256": "69ee8af7700e4aefa33656c7cf0e6f5e37061b1393104ae0cb8c830260927090"
    },
    {
      "path": "licenses/Qwen3.5-4B-LICENSE.txt",
      "sha256": "bbedc3fda3305820b977265f01b8619d87570a6739de3a5582c3464840f1e57a"
    },
    {
      "path": "licenses/rotate-bits-MIT.txt",
      "sha256": "6d1a68e8ae5085d15a5c4f8dc1363b7bf256756b3a49cbaf29fe7f7a49eae4e3"
    },
    {
      "path": "licenses/sha256-public-domain.txt",
      "sha256": "24836bd0f33996623060eabeb765fb0b091bcbca47e6e6e9493385df8ce9e30a"
    },
    {
      "path": "licenses/Unicode-License-V3.txt",
      "sha256": "e7a93b009565cfce55919a381437ac4db883e9da2126fa28b91d12732bc53d96"
    },
    {
      "path": "licenses/worker-source-avx2.zip",
      "sha256": "7a6b8e6c875650730b73827867a5f431e1062b71a27d282d3f942c2a85a5600c"
    },
    {
      "path": "licenses/xxhash-BSD-2-Clause.txt",
      "sha256": "a2973411d278045bde3c7161b911e0680d53e2d73d6457c77068d2e55d816d67"
    },
    {
      "path": "minimum-smoke-results.json",
      "sha256": "41edf597b3c93b425e51d19725afc727727fe154878a22b73154cb898e77e6c9"
    },
    {
      "path": "preparation-report.md",
      "sha256": "2f72bd263fae8d58be57b8a5902558c8a7e4b98f8d95a141c3527e975bff1c10"
    },
    {
      "path": "README.md",
      "sha256": "43b2139b9775f1607a86cf7e804f79a849c20c63dbb1c7bb104990fb7b9f0add"
    },
    {
      "path": "weights/Qwen3.5-4B-baseline-Q6_K.gguf",
      "sha256": "3acaea00a98af4e8cb7195259d7dd903b0cc749dff61a8cf47274c9a91ed02f6"
    }
  ]
}
